{
  "schemaVersion": "mavi-embedding-control-v1",
  "analysisId": "01a1a000-0000-7000-8000-000000000001",
  "workerId": "mavi-embeddings-1",
  "attemptCount": 1,
  "provenance": {
    "roleId": "embeddings",
    "identityFingerprint": "13bac41fa80540fd901008853baf5b958e31e1321c948936038d7e2e91646f12",
    "runtimeProfileId": "embeddings-onnx-v1",
    "runtimeVariant": "windows-x86_64-cpu",
    "executionProvider": "CPUExecutionProvider",
    "actualDevice": "cpu",
    "deviceResolutionReason": "explicit_cpu",
    "onnxRuntimeVersion": "1.31.0",
    "workerVersion": "1.0.0"
  },
  "tracks": [
    {
      "trackId": "01a1a000-0000-7000-8000-0000000000b1",
      "outcome": "embedded",
      "sourceObservationIds": [
        "01a1a000-0000-7000-8000-0000000000c1",
        "01a1a000-0000-7000-8000-0000000000c2"
      ],
      "embedding": "ZjOpvBXPGbvIWYU8iPAFPWETNz3ybk89R7dLPS5tLD2Qmes8Nus8PN7c7bumV828prYhvVzeRr2YG1G9kws/vSYgE70blqa8wP8Cu4gNiDyCCAc9kcM3PYCfTz2gYUs96pwrPSw86TyaWjc8Iij5uyXTz7y7nSK9gE9HvXoHUb3udD69WxsSvdb2o7y4Xdi6qr+KPOIeCD2TcTg9ls1PPY4JSz2byio9A9zmPM/HMTw4OAK8LEzSvOGCI71Fvke94fBQvQTcPb3VFBG9nVWhvF65qromcI08pDMJPWMdOT00+U89Eq9KPUT2KT0beeQ85zIsPNLaB7yywtS8FmYkvasqSL3M11C92UA9vZQMEL15sp68+CV6uvQekDzERgo9AMc5PVgiUD0tUko96B8pPXsT4jzymyY8z3sNvLE217xWRyW9r5RIvTu8UL1uozy9nQIPvXMNnLw71h66CsySPD9YCz1nbjo9A0lQPeDyST2JRyg9K6vfPAMDITwdGxO8IajZvJ8mJr1R/Ei9Lp5QvcUDPL3z9g29kWaZvDYJh7lid5U8EmgMPZcTOz01bVA9LZFJPSptJz0zQN08KmgbPKy4GLz6Fty87gMnvY9hSb2nfVC94GE7vZnpDL3dvZa8mG6+OPQgmDw6dg09jrY7PeyOUD0ULUk9zpAmPZnS2jx4yxU8alQevDaD3rxB3ye9aMRJvaZaUL3AvTq9ktoLvV0TlLzxP+Y5tsiaPLOCDj1JVzw9KK5QPZfGSD13siU9ZmLYPP4sEDxF7iO8zOzgvJa4KL3bJEq9KjVQvWgXOr3iyQq9G2eRvL9wTjqhbp08e40PPcf1PD3pylA9tl1IPSfSJD2f79U8zYwKPC6GKby2U+O86I8pveeCSr00DVC92m45vYu3Cb0fuY68id+UOq0SoDyOlhA9BpI9PS7lUD108kc94u8jPU560zz26gQ8ExwvvOy35bw3ZSq9i95KvcbiT70XxDi9kaMIvXAJjLzthMI60bSiPOidET0ELD49+PxQPdKERz2pCyM9eQLRPBaP/jvkrzS8ZxnovH84K73FN0u93rVPvSIXOL33jQe9F1iJvAEo8DoHVaU8h6MSPb/DPj1GElE90BRHPYElIj0oiM48OUXzO45BOrwfeOq8vgksvZSOS71/hk+9/Wc3vcB2Br0cpYa8HeQOO0XzpzxppxM9Nlk/PRglUT1wokY9az0hPWILzDx4+Oc7AdE/vA7U7Lzx2Cy9+OJLvahUT72qtja98F0FvYfwg7yHsiU7hI+qPIipFD1m7D89bTVRPbQtRj1qUyA9L4zJPPSo3DstXkW8LC3vvBemLb3wNEy9WSBPvSoDNr2LQwS9YTqBvPl+PDu8Ka085KkVPU59QD1FQ1E9nbZFPYJnHz2XCsc80VbRO//oSrxyg/G8K3EuvXqETL2V6U69gE01vZInA71iBX28LElTO+XBrzx3qBY97AtBPaBOUT0sPUU9tHkePaGGxDwxAsY7aXFQvNnW87wtOi+9ltFMvVuwTr2vlTS9CwoCvQGTd7zdEGo791eyPEGlFz0/mEE9f1dRPWLBRD0Eih09VQDCPDerujtX91W8Wif2vBoBML1CHE29q3ROvbjbM7346gC9rh1yvONqgDvr67Q8PKAYPUUiQj3gXVE9QkNEPXSYHD27d788BFKvO7t6W7zudPi878UwvX5kTb2INk69nh8zvbmU/7x6pWy80MuLO7d9tzxnmRk9+6lCPcRhUT3NwkM9CKUbPdrsvDy79qM7g/tgvI6/+ryqiDG9SapNvfD1Tb1iYTK9eFD9vHYqZ7wUK5c7Vg26PL+QGj1iL0M9KmNRPQNAQz3Crxo9ul+6PICZmDueeWa8Mgf9vEhJMr2i7U295rJNvQihMb00Cfu8sqxhvIyIoju+mrw8QIYbPXayQz0UYlE96LpCPaa4GT1i0Lc8dDqNO/v0a7zUS/+8yAczvYguTr1qbU29kd4wvfS++LxALFy8FeStO+glvzzoeRw9NzNEPYBeUT18M0I9tb8YPds+tTy62YE7i21xvLfGAL0nxDO9+2xOvX0lTb0AGjC9v3H2vDCpVryNPbk7zK7BPLRrHT2isUQ9b1hRPcCpQT30xBc9LauyPOvubDs743a8/OUBvWN+NL35qE69H9tMvVZTL72cIfS8kiNRvNGUxDtjNcQ8oVsePbctRT3hT1E9uB1BPWTIFj1fFbA8kCdWO/1VfLy1AwO9ejY1vYPiTr1Sjky9l4ouvZLO8bx3m0u8v+nPO6S5xjyrSR89dKdFPdZEUT1jj0A9CsoVPXl9rTyqXT873+KAvOAfBL1p7DW9lxlPvRY/TL3Fvy29qHjvvPEQRrw0PNs7iTvJPNE1ID3XHkY9TjdRPcX+Pz3oyRQ9g+OqPH2RKDs3mYO8eDoFvS6gNr00Tk+9be1LvePyLL3lH+28EYRAvA6M5jsKu8s8ECAhPd+TRj1JJ1E93ms/PQHIEz2ER6g8T8MRO/9Nhrx7Uwa9yFE3vVuAT71XmUu98SMsvVHE6rzm9Dq8KtnxOx44zjxjCCI9iwZHPcgUUT2w1j49WcQSPYappTzK5vU6LgGJvOZqB700ATi9CrBPvdVCS730Uiu98mXovIJjNbxmI/07v7LQPMruIj3Zdkc9yv9QPT4/Pj3xvhE9jwmjPApEyDq8sou8tIAIvXCuOL1B3U+96elKve5/Kr3PBOa89s8vvFA1BDzkKtM8QdMjPcjkRz1Q6FA9iaU9Pc63ED2oZ6A86J6aOqFijrzjlAm9eVk5vf8HUL2Tjkq94KopvfGg47xUOiq8WtcJPIeg1TzFtSQ9V1BIPVvOUD2TCT09864PPdrDnTzh71k61RCRvG6nCr1PAjq9RTBQvdQwSr3O0yi9XjrhvKuiJLzBdw88nxPYPFSWJT2EuUg96rFQPV1rPD1ipA49Kh6bPLQ+/TlPvZO8VLgLve6oOr0QVlC9r9BJvbv6J70d0d68DQkfvHMWFTwnhNo863QmPU4gST39klA96so7PR+YDT2jdpg8RTUNOQdolryRxwy9VU07vWJ5UL0jbkm9qB8nvTdl3LyLbRm8YLMaPBXy3DyIUSc9tIRJPZZxUD07KDs9LooMPUzNlTyLFGC59hCZvCHVDb2D7zu9OZpQvTIJSb2YQia9sfbZvDbQE7x2TiA8Yl3fPCcsKD215kk9tU1QPVODOj2Qegs9LSKTPOxWE7oTuJu8AuEOvXSPPL2VuFC93aFIvY5jJb2Uhde8HzEOvKTnJTwIxuE8xgQpPU9GSj1ZJ1A9M9w5PUppCj1OdZA89aZuulZdnrww6w+9Jy09vXbUUL0lOEi9jYIkvecR1bxXkAi82H4rPP4r5Dxj2yk9gaNKPYT+Tz3dMjk9X1YJPbfGjTwU+qS6twChvKjzEL2byD292+1QvQ3MR72YnyO9spvSvPDtArwDFDE8Po/mPPuvKj1L/ko9N9NPPVSHOD3SQQg9cRaLPLee0rouoqO8ZvoRvc1hPr3FBFG9lF1HvbC6Ir38ItC89JP6uxOnNjzB7+g8jIIrPatWSz1wpU89mdk3PaYrBz2EZIg8bSAAu7NBprxo/xK9u/g+vTIZUb287Ea92dMhvcynzbwOSe+7+Dc8PH5N6zwSUyw9oaxLPTJ1Tz2uKTc93hMGPfewhTz47xa7Pd+ovKsCFL1ljT+9IytRvYd5Rr0W6yC9KirLvFD747ufxkE8cKjtPIwhLT0qAEw9fEJPPZZ3Nj1/+gQ91PuCPLi9LbvGequ8LAQVvccfQL2YOlG99gNGvWkAIL0eqsi826rYu/hSRzyOAPA89+0tPUZRTD1PDU89U8M1PYvfAz0iRYA8Z4lEu0UUrrznAxa94a9AvY9HUb0KjEW91RMfvbAnxrzUV82789xMPNFV8jxRuC499Z9MPazVTj3nDDU9BsMCPdIZezzAUlu7s6uwvNkBF72wPUG9ClJRvcURRb1dJR695qLDvFsCwrt/ZFI8NKj0PJeALz017Ew9lJtOPVNUND3ypAE9ZaZ1PH0ZcrsGQbO8AP4XvTPJQb0HWlG9KJVEvQM1Hb3JG8G8lKq2u4rpVzyt9/Y8"
    },
    {
      "trackId": "01a1a000-0000-7000-8000-0000000000b2",
      "outcome": "unavailable",
      "reason": "evidence_too_small"
    },
    {
      "trackId": "01a1a000-0000-7000-8000-0000000000b3",
      "outcome": "unavailable",
      "reason": "no_evidence"
    }
  ]
}
